<?xml version="1.0" encoding="UTF-8"?>
<xs:schema xmlns:xs="http://www.w3.org/2001/XMLSchema"
           targetNamespace="http://www.example.com/schema-3"
           xmlns="http://www.example.com/schema-3"
           xmlns:tns="http://www.example.com/schema-3"
           xmlns:xml="http://www.w3.org/XML/1998/namespace"
           elementFormDefault="qualified">
    <xs:import namespace="http://www.w3.org/XML/1998/namespace"
        schemaLocation="https://www.w3.org/2009/01/xml.xsd" />
    <xs:complexType name="langElement">
        <xs:simpleContent>
            <xs:extension base="xs:string">
                <xs:attribute ref="xml:lang" use="required"/>
            </xs:extension>
        </xs:simpleContent>
    </xs:complexType>
    <xs:simpleType name="phoneNumberType">
        <xs:restriction base="xs:string">
            <xs:pattern value="\+[0-9]{3}-[0-9]{3}-[0-9]{3}-[0-9]{3}"/>
        </xs:restriction>
    </xs:simpleType>
    <xs:complexType name="Person">
        <xs:sequence>
            <xs:element name="firstName" type="tns:langElement"/>
            <xs:element name="lastName" type="tns:langElement"/>
            <xs:element name="mobileNumber" type="tns:phoneNumberType" minOccurs="0" maxOccurs="unbounded"/>
        </xs:sequence>
    </xs:complexType>
    <xs:element name="Teachers">
        <xs:complexType>
            <xs:sequence>
                <xs:element name="Teacher" maxOccurs="unbounded">
                    <xs:complexType>
                        <xs:complexContent>
                            <xs:extension base="tns:Person">
                                <xs:sequence>
                                    <xs:element name="salary" type="xs:integer"/>
                                    <xs:element name="Subject" minOccurs="0" maxOccurs="unbounded">
                                        <xs:complexType>
                                            <xs:sequence>
                                                <xs:element name="name" type="tns:langElement"/>
                                                <xs:element name="name" type="tns:langElement"/>
                                                <xs:element name="code" type="xs:string"/>
                                            </xs:sequence>
                                            <xs:attribute name="id" type="xs:anyURI" use="required"/>
                                        </xs:complexType>
                                    </xs:element>
                                    <xs:element name="Building" minOccurs="0" maxOccurs="1">
                                        <xs:complexType>
                                            <xs:sequence>
                                                <xs:element name="address" type="tns:langElement"/>
                                                <xs:element name="name" type="tns:langElement"/>
                                            </xs:sequence>
                                            <xs:attribute name="id" type="xs:anyURI" use="required"/>
                                        </xs:complexType>
                                    </xs:element>
                                </xs:sequence>
                                <xs:attribute name="id" type="xs:anyURI" use="required"/>
                            </xs:extension>
                        </xs:complexContent>
                    </xs:complexType>
                </xs:element>
            </xs:sequence>
        </xs:complexType>
    </xs:element>
</xs:schema>